{
  "schema_version": "1.1.0",
  "dataset_id": "gate-1.1-lima-province-gasohol-regular-2026-08-14",
  "scope": {
    "journey": "J1",
    "department": "LIMA",
    "province": "LIMA",
    "population": "todas las ofertas frescas de Lima provincia; sin límite distrital",
    "origin_policy": "ubicación actual real o simulada; idéntica en A y B",
    "product": "Gasohol Regular",
    "display_unit": "S/ por galón",
    "usage": "experimento privado; no publicar"
  },
  "temporal_context": {
    "snapshot_date": "2026-08-14",
    "source_max_reported_at": "2026-08-13T12:00:00.000Z",
    "cutoff_at": "2026-08-14T16:32:44.301Z",
    "acquisition_started_at": "2026-08-14T16:31:39.179Z",
    "acquisition_completed_at": "2026-08-14T16:32:44.301Z",
    "source_last_modified_at": "2026-08-14T12:28:52.000Z"
  },
  "offers": [
    {
      "experimental_id": "offer_111111111111111111111111",
      "establishment_id": "est_222222222222222222222222",
      "source_row_id": "row_333333333333333333333333",
      "product": "Gasohol Regular",
      "currency": "PEN",
      "unit": "galón",
      "display_unit": "S/ por galón",
      "price": 17.49,
      "price_reported_at": "2026-08-13T14:30:00.000Z",
      "age_days_at_cutoff": 1.085,
      "territory": {
        "department": "LIMA",
        "province": "LIMA",
        "district": "SANTIAGO DE SURCO"
      },
      "coordinate": {
        "longitude": -76.99,
        "latitude": -12.13,
        "classification": "coordenada oficial exacta; reutilización pública no autorizada"
      },
      "provisional_identity": {
        "label": "IDENTIDAD PROVISIONAL — razón social/dirección",
        "legal_name": "OPERADOR SINTÉTICO PARA PRUEBAS S.A.C.",
        "address": "AVENIDA SINTÉTICA 123, SANTIAGO DE SURCO"
      },
      "source": {
        "dataset_id": "liquid-current",
        "snapshot_date": "2026-08-14",
        "acquired_at": "2026-08-14T16:32:44.301Z",
        "cutoff_at": "2026-08-14T16:32:44.301Z"
      },
      "warnings": [
        "IDENTIDAD PROVISIONAL: la razón social y la dirección no equivalen a nombre comercial.",
        "El precio reportado no demuestra stock.",
        "Uso exclusivo del experimento privado; no publicar."
      ]
    }
  ]
}
