{
  "schema_version": "1.1.0",
  "dataset_id": "lima-province-gasohol-regular-2026-08-14",
  "scope": {
    "journey": "J1",
    "department": "LIMA",
    "province": "LIMA",
    "population": "todas las ofertas frescas de Lima provincia; sin límite distrital",
    "origin_policy": "ubicación actual real o simulada; idéntica en A y B",
    "product": "Gasohol Regular",
    "display_unit": "S/ por galón",
    "usage": "experimento privado; no publicar"
  },
  "temporal_context": {
    "snapshot_date": "2026-08-14",
    "source_max_reported_at": "2026-08-13T12:00:00.000Z",
    "cutoff_at": "2026-08-14T16:32:44.301Z",
    "acquisition_started_at": "2026-08-14T16:31:39.179Z",
    "acquisition_completed_at": "2026-08-14T16:32:44.301Z",
    "source_last_modified_at": "2026-08-14T12:28:52.000Z"
  },
  "offers": [
    {
      "experimental_id": "offer_111111111111111111111111",
      "establishment_id": "est_222222222222222222222222",
      "source_row_id": "row_333333333333333333333333",
      "product": "Gasohol Regular",
      "currency": "PEN",
      "unit": "galón",
      "display_unit": "S/ por galón",
      "price": 17.49,
      "price_reported_at": "2026-08-13T14:30:00.000Z",
      "age_days_at_cutoff": 1.085,
      "territory": {
        "department": "LIMA",
        "province": "LIMA",
        "district": "SANTIAGO DE SURCO"
      },
      "coordinate": {
        "longitude": -76.99,
        "latitude": -12.13,
        "classification": "coordenada oficial exacta; reutilización pública no autorizada"
      },
      "provisional_identity": {
        "label": "IDENTIDAD PROVISIONAL — razón social/dirección",
        "legal_name": "OPERADOR SINTÉTICO PARA PRUEBAS S.A.C.",
        "address": "AVENIDA SINTÉTICA 123, SANTIAGO DE SURCO"
      },
      "source": {
        "dataset_id": "liquid-current",
        "snapshot_date": "2026-08-14",
        "acquired_at": "2026-08-14T16:32:44.301Z",
        "cutoff_at": "2026-08-14T16:32:44.301Z"
      },
      "warnings": [
        "IDENTIDAD PROVISIONAL: la razón social y la dirección no equivalen a nombre comercial.",
        "El precio reportado no demuestra stock.",
        "Uso exclusivo del experimento privado; no publicar."
      ]
    },
    {
      "experimental_id": "offer_444444444444444444444444",
      "establishment_id": "est_555555555555555555555555",
      "source_row_id": "row_666666666666666666666666",
      "product": "Gasohol Regular",
      "currency": "PEN",
      "unit": "galón",
      "display_unit": "S/ por galón",
      "price": 18.2,
      "price_reported_at": "2026-08-14T10:32:44.301Z",
      "age_days_at_cutoff": 0.25,
      "territory": { "department": "LIMA", "province": "LIMA", "district": "SAN ISIDRO" },
      "coordinate": { "longitude": -77.036, "latitude": -12.097, "classification": "coordenada oficial exacta; reutilización pública no autorizada" },
      "provisional_identity": {
        "label": "IDENTIDAD PROVISIONAL — razón social/dirección",
        "legal_name": "ENERGÍA SINTÉTICA DEL CENTRO S.A.C.",
        "address": "AVENIDA DE PRUEBA 456, SAN ISIDRO"
      },
      "source": { "dataset_id": "liquid-current", "snapshot_date": "2026-08-14", "acquired_at": "2026-08-14T16:32:44.301Z", "cutoff_at": "2026-08-14T16:32:44.301Z" },
      "warnings": [
        "IDENTIDAD PROVISIONAL: la razón social y la dirección no equivalen a nombre comercial.",
        "El precio reportado no demuestra stock.",
        "Uso exclusivo del experimento privado; no publicar."
      ]
    },
    {
      "experimental_id": "offer_777777777777777777777777",
      "establishment_id": "est_888888888888888888888888",
      "source_row_id": "row_999999999999999999999999",
      "product": "Gasohol Regular",
      "currency": "PEN",
      "unit": "galón",
      "display_unit": "S/ por galón",
      "price": 17.8,
      "price_reported_at": "2026-08-09T16:32:44.301Z",
      "age_days_at_cutoff": 5,
      "territory": { "department": "LIMA", "province": "LIMA", "district": "MIRAFLORES" },
      "coordinate": { "longitude": -77.03, "latitude": -12.121, "classification": "coordenada oficial exacta; reutilización pública no autorizada" },
      "provisional_identity": {
        "label": "IDENTIDAD PROVISIONAL — razón social/dirección",
        "legal_name": "COMBUSTIBLES DEMO PACÍFICO S.A.C.",
        "address": "CALLE DE DEMOSTRACIÓN 789, MIRAFLORES"
      },
      "source": { "dataset_id": "liquid-current", "snapshot_date": "2026-08-14", "acquired_at": "2026-08-14T16:32:44.301Z", "cutoff_at": "2026-08-14T16:32:44.301Z" },
      "warnings": [
        "IDENTIDAD PROVISIONAL: la razón social y la dirección no equivalen a nombre comercial.",
        "El precio reportado no demuestra stock.",
        "Uso exclusivo del experimento privado; no publicar."
      ]
    },
    {
      "experimental_id": "offer_aaaaaaaaaaaaaaaaaaaaaaaa",
      "establishment_id": "est_bbbbbbbbbbbbbbbbbbbbbbbb",
      "source_row_id": "row_cccccccccccccccccccccccc",
      "product": "Gasohol Regular",
      "currency": "PEN",
      "unit": "galón",
      "display_unit": "S/ por galón",
      "price": 16.9,
      "price_reported_at": "2026-07-25T16:32:44.301Z",
      "age_days_at_cutoff": 20,
      "territory": { "department": "LIMA", "province": "LIMA", "district": "SAN BORJA" },
      "coordinate": { "longitude": -76.998, "latitude": -12.105, "classification": "coordenada oficial exacta; reutilización pública no autorizada" },
      "provisional_identity": {
        "label": "IDENTIDAD PROVISIONAL — razón social/dirección",
        "legal_name": "SERVICIOS CONTROLADOS DE LIMA S.A.C.",
        "address": "JIRÓN DEL FIXTURE 321, SAN BORJA"
      },
      "source": { "dataset_id": "liquid-current", "snapshot_date": "2026-08-14", "acquired_at": "2026-08-14T16:32:44.301Z", "cutoff_at": "2026-08-14T16:32:44.301Z" },
      "warnings": [
        "IDENTIDAD PROVISIONAL: la razón social y la dirección no equivalen a nombre comercial.",
        "El precio reportado no demuestra stock.",
        "Uso exclusivo del experimento privado; no publicar."
      ]
    }
  ]
}
